{
  "$schema": "https://json-schema.org/draft/2020-12/schema",
  "$id": "https://github.com/AICTRI/agent-iam-spec/schemas/requests/approval-request.schema.json",
  "title": "Approval Request",
  "description": "Approval binding defined in Part 4 Section 5.3.",
  "x-agent-iam-part": "agent-iam-4-authorization",
  "type": "object",
  "additionalProperties": false,
  "required": [
    "namespace",
    "approver",
    "agentOrActor",
    "action",
    "resource",
    "scope",
    "audience",
    "reasonDigest",
    "expiresAt",
    "policyVersion"
  ],
  "properties": {
    "namespace": { "type": "string", "format": "uri" },
    "approver": { "type": "string" },
    "agentOrActor": { "type": "string" },
    "action": { "type": "string" },
    "resource": {
      "type": "object",
      "required": ["type", "id"],
      "properties": {
        "type": { "type": "string" },
        "id": { "type": "string" },
        "digest": { "type": "string" }
      }
    },
    "scope": { "type": "array", "items": { "type": "string" } },
    "audience": { "type": "string" },
    "reasonDigest": { "type": "string" },
    "expiresAt": { "type": "integer" },
    "policyVersion": { "type": "string" }
  }
}
