{
  "namespace": "https://id.example.com/org/acme",
  "approver": "human:alice",
  "agentOrActor": "agt_01JABCDEF0000000000000000",
  "action": "payments.transfer",
  "resource": { "type": "account", "id": "acct_42" },
  "scope": ["payments:transfer"],
  "audience": "https://payments.example.com",
  "reasonDigest": "sha256:abcd",
  "expiresAt": 1900000300,
  "policyVersion": "7"
}
